{"approval_card_digest":"2382d541b3b6a15c32c7c4a95b0fa947e63ea33fd8a92f194d5efd8ba537c071","approval_card_id":"approval_2382d541b3b6a15c32c7c4a9","approval_event_id":"approval_event_d3aaf51e94ace4eeec6129af","contract_digest":"1a80f7b6b407a941eb5ba6f36c023fd24b2b6cb9186afbb6d2654f9de99d4b15","contract_id":"pep_design_project_acceptance","contract_version":"1.0.0","decision":"approved","evaluation_id":"evaluation_c275edb91f1b6b2f980d470b","evidence_digest":"7f99796e174d02bb9391990cfce3a0fb40b78ec2b92e6be0c6b8385e5eb3e79e","profile_id":"current_phase","rationale":"接受 v0.33 的诚实边界：10 条 method-specific blockers，0 个 parsed/generated candidates，target/control 尚未冻结，scoring/ranking 尚未启动。","reviewed_at":"2026-07-11T11:09:58.780862+00:00","reviewer_id":"project_owner","role":"governance_owner","supersedes":null}
